[
  {
    "id": 1,
    "image": "/images/properties/office-bkc.jpg",
    "name": "Premium Office Space - BKC",
    "location": "Bandra Kurla Complex, Mumbai",
    "price": "₹2.5 Cr onwards",
    "area": "2500 sq.ft",
    "type": "Commercial",
    "category": "Office Space",
    "status": "Ready to Move",
    "summary": "Premium Grade-A office space in Mumbai's premier business district"
  },
  {
    "id": 2,
    "image": "/images/properties/retail-phoenix.jpg",
    "name": "Retail Shop - Phoenix Mall",
    "location": "Lower Parel, Mumbai",
    "price": "₹1.8 Cr onwards",
    "area": "1200 sq.ft",
    "type": "Commercial",
    "category": "Retail Shop",
    "status": "Ready to Move",
    "summary": "High-footfall retail space in premium mall location"
  },
  {
    "id": 3,
    "image": "/images/properties/office-cyber-city.jpg",
    "name": "Corporate Office - Cyber City",
    "location": "Gurgaon, Delhi NCR",
    "price": "₹3.2 Cr onwards",
    "area": "3500 sq.ft",
    "type": "Commercial",
    "category": "Office Space",
    "status": "Under Construction",
    "summary": "Modern corporate office with state-of-the-art amenities"
  },
  {
    "id": 4,
    "image": "/images/properties/showroom-mg-road.jpg",
    "name": "Showroom Space - MG Road",
    "location": "Bangalore",
    "price": "₹2 Cr onwards",
    "area": "1800 sq.ft",
    "type": "Commercial",
    "category": "Showroom",
    "status": "Ready to Move",
    "summary": "Prime showroom space on Bangalore's busiest commercial street"
  },
  {
    "id": 5,
    "image": "/images/properties/luxury-worli.jpg",
    "name": "Luxury Residences - Worli",
    "location": "Worli, Mumbai",
    "price": "₹4.5 Cr onwards",
    "area": "2200 sq.ft",
    "type": "Residential",
    "category": "Apartment",
    "status": "Under Construction",
    "bhk": "3 BHK",
    "summary": "Sea-facing luxury apartments with world-class amenities"
  },
  {
    "id": 6,
    "image": "/images/properties/urban-whitefield.jpg",
    "name": "Urban Homes - Whitefield",
    "location": "Whitefield, Bangalore",
    "price": "₹1.2 Cr onwards",
    "area": "1450 sq.ft",
    "type": "Residential",
    "category": "Apartment",
    "status": "Ready to Live In",
    "bhk": "2 BHK",
    "summary": "Modern apartments in IT hub with excellent connectivity"
  },
  {
    "id": 7,
    "image": "/images/properties/business-park-midc.jpg",
    "name": "Business Park - MIDC",
    "location": "Andheri, Mumbai",
    "price": "₹5 Cr onwards",
    "area": "5000 sq.ft",
    "type": "Commercial",
    "category": "Business Park",
    "status": "Ready to Move",
    "summary": "Complete business park solution with parking and amenities"
  },
  {
    "id": 8,
    "image": "/images/properties/villas-chattarpur.jpg",
    "name": "Garden Villas - Chattarpur",
    "location": "Chattarpur, Delhi",
    "price": "₹6.5 Cr onwards",
    "area": "3500 sq.ft",
    "type": "Residential",
    "category": "Villa",
    "status": "Under Construction",
    "bhk": "4 BHK",
    "summary": "Spacious villas with private gardens and premium lifestyle"
  },
  {
    "id": 9,
    "image": "/images/properties/penthouse-marine-drive.jpg",
    "name": "Penthouse - Marine Drive",
    "location": "Marine Drive, Mumbai",
    "price": "₹12 Cr onwards",
    "area": "4500 sq.ft",
    "type": "Residential",
    "category": "Penthouse",
    "status": "Ready to Live In",
    "bhk": "5 BHK",
    "summary": "Ultra-luxury penthouse with panoramic sea views"
  },
  {
    "id": 10,
    "image": "/images/properties/warehouse-bhiwandi.jpg",
    "name": "Logistics Warehouse - Bhiwandi",
    "location": "Bhiwandi, Maharashtra",
    "price": "₹8 Cr onwards",
    "area": "15000 sq.ft",
    "type": "Commercial",
    "category": "Warehouse",
    "status": "Ready to Move",
    "summary": "Strategic warehouse location with highway connectivity"
  }
]
